{
  "$schema": "https://json-schema.org/draft/2020-12/schema",
  "$id": "https://rimeflow.dev/schemas/model-manifest.schema.json",
  "title": "RimeFlow model manifest v1",
  "type": "object",
  "required": ["schemaVersion", "model", "tensors", "artifacts"],
  "additionalProperties": false,
  "properties": {
    "schemaVersion": { "const": 1 },
    "model": {
      "type": "object",
      "required": ["id", "version"],
      "additionalProperties": false,
      "properties": {
        "id": { "type": "string", "minLength": 1 },
        "version": { "type": "string", "minLength": 1 }
      }
    },
    "tensors": {
      "type": "object",
      "required": ["inputs", "outputs"],
      "additionalProperties": false,
      "properties": {
        "inputs": { "$ref": "#/$defs/tensors" },
        "outputs": { "$ref": "#/$defs/tensors" }
      }
    },
    "artifacts": {
      "type": "array",
      "minItems": 1,
      "items": { "$ref": "#/$defs/artifact" }
    }
  },
  "$defs": {
    "tensors": {
      "type": "array",
      "minItems": 1,
      "items": {
        "type": "object",
        "required": ["role", "shape", "layout", "dtype"],
        "additionalProperties": false,
        "anyOf": [
          { "required": ["name"] },
          { "required": ["index"] }
        ],
        "properties": {
          "role": { "type": "string", "minLength": 1 },
          "name": { "type": "string", "minLength": 1 },
          "index": { "type": "integer", "minimum": 0 },
          "shape": {
            "type": "array",
            "minItems": 1,
            "items": { "type": "integer", "minimum": 1 }
          },
          "layout": { "enum": ["NCHW", "NHWC"] },
          "dtype": { "enum": ["f32", "f16", "i8", "u8", "i32", "i64", "bool"] },
          "quantization": {
            "type": "object",
            "additionalProperties": false,
            "properties": {
              "scale": { "type": "number", "exclusiveMinimum": 0 },
              "zeroPoint": { "type": "integer" }
            }
          }
        },
        "allOf": [
          {
            "if": { "properties": { "dtype": { "enum": ["i8", "u8"] } } },
            "then": {
              "required": ["quantization"],
              "properties": {
                "quantization": { "required": ["scale", "zeroPoint"] }
              }
            }
          }
        ]
      }
    },
    "artifact": {
      "type": "object",
      "required": ["id", "format", "targets", "path", "sha256", "inputs", "outputs"],
      "additionalProperties": false,
      "properties": {
        "id": { "type": "string", "minLength": 1 },
        "format": { "enum": ["onnx", "coreml", "tflite", "windowsml", "mindspore-lite"] },
        "targets": {
          "type": "array",
          "minItems": 1,
          "items": {
            "type": "object",
            "required": ["os", "arch"],
            "additionalProperties": false,
            "properties": {
              "os": { "type": "string", "minLength": 1 },
              "arch": { "type": "string", "minLength": 1 }
            }
          }
        },
        "path": { "type": "string", "minLength": 1 },
        "sha256": { "type": "string", "pattern": "^(?!0{64}$)[a-f0-9]{64}$" },
        "converter": {
          "type": "object",
          "required": ["name", "version"],
          "additionalProperties": false,
          "properties": {
            "name": { "type": "string", "minLength": 1 },
            "version": { "type": "string", "minLength": 1 }
          }
        },
        "inputs": { "type": "array", "minItems": 1, "items": { "type": "string", "minLength": 1 } },
        "outputs": { "type": "array", "minItems": 1, "items": { "type": "string", "minLength": 1 } }
      }
    }
  }
}
